{
  "$schema": "schema/job-config-schema.json",
  "job": {
    "name": "batch-csv2console",
    "mode": "batch",
    "parallelism": 1
  },
  "sources": [
    {
      "type": "localfile",
      "outputTable": "source_table",
      "config": {
        "path": "docs/examples/data/*.csv",
        "format": "csv",
        "encoding": "UTF-8",
        "delimiter": ",",
        "skipHeader": true,
        "schema": {
          "id": "LONG",
          "name": "STRING",
          "age": "INT",
          "email": "STRING"
        }
      }
    }
  ],
  "transforms": [
    {
      "type": "sql",
      "outputTable": "transform_table",
      "config": {
        "sql": "SELECT *,hash_code(email) as hash_code FROM source_table"
      }
    }
  ],
  "sinks": [
    {
      "type": "console",
      "inputTable": "transform_table"
    }
  ]
}